Pickle Back Happy Hour,The Thifty Pickle,The Thrifty Pickle,"Friday, June 5",05:00:00 PM,07:00:00 PM,Food,"Come join us for pickle back happy hour! Have a shot of room temp whiskey followed by a shot of our finest ice cold pickle juice while you browse the shop or hang at the bar. We’ll keep the drinks flowing while supplies last, you just bring the cup!",Bring your own cup or leave with a shot glass!,True,False,True,dust/events_forms.csv
Pole Abiding 101,,Abiding Grove,"Friday, June 5",11:00:00 AM,12:30:00 PM,Workshop,"Pole Abiding 101\nFriday • 11:00 AM • ~90 min\nThe Dude way is balance, flow, and not fighting the universe too hard. Join Smooth for a beginner-friendly outdoor pole dance session where style matters less than attitude. Come laugh, move around, and discover that maybe the pole isn't the enemy here. Weather permitting. Bar beverages available because hydration is part of the path.",,False,False,True,dust/events_forms.csv
Principles Round Table,Principles Working Group,Grotto - Open Community Space,"Friday, June 5",04:00:00 PM,05:00:00 PM,Workshop,Educational workshop discussing the principles.,"Asking attendees to bring chairs, blankets. We may provide a small table or blanket to set snacks and drinks on.",False,True,True,dust/events_forms.csv
Ranger Training,,Ranger HQ,"Thursday, June 4",05:00:00 PM,06:30:00 PM,Workshop,"This training is intended for anyone with an Alpha Ranger, Dirt Ranger, or Khaki Ranger volunteer shift at ToTheMoon -- or anyone who just wants to learn more about these awesome volunteers. \n\nToTheMoon Rangers team is looking for quite a few volunteers to join their team! Rangers aren’t security or bouncers or police…but they are sober adults in cargo pants and matching shirts that walk the burn and assist in mediation or connecting you with the type of help you may need… These volunteers are extremely important and help keep the burn a safe space for everyone. \n\nNOTE: Please bring your own water bottle, chair/blanket, sun protection, snack, and/or stuffie to the training to exemplify your Radical Self-Reliance.",,False,False,True,dust/events_forms.csv
ReBirthDay Party,Garden Party,Garden Party,"Saturday, June 6",02:00:00 PM,05:00:00 PM,Party,"💖Happy ReBirthDay🌱\n\nIn support of Participation, Communal Effort, and Gifting, Garden Party is delighted to host a ReBirthDay Party for YOU! \n\nWe are providing a ReBirthDay cake, sweet treats, salty and savory snacks and presents! \n\nWe hope YOU are bringing:\n🎨 Face painting\n🤹 Jugglers & flow artists\n🎶 Musicians & wandering instrumentalists\n📖 Poetry readers & storytellers\n🎤 Singers & sing-a-long leaders\n🛠 Teachers of curious skills & hobbies\n😂 Stand-up comics & delightfully bad comedians\n🔮 Tarot readers, oracle readers & mystical beings\n\nThis is not about perfection.\nThis is about participation, play, connection, expression, and creating moments together.\n\nWhether you are wildly talented, charmingly awkward, deeply soulful, or charismatically chaotic — there is a place for you at the party.\n\nBring a gift.\nBring a skill.\nBring a ridiculous idea.\nBring your strange little spark.\nBring your magical presence.\n\nDon't forget to pick up your ReBirth Certificate before you leave!",Yes,True,False,True,dust/events_forms.csv
Rockband Karaoke!,Green Room,,"Friday, June 5th",7:30:00 PM,11:30:00 PM,Performance,"Remember Guitar Hero? Rockband Karaoke is like normal karaoke, except all the songs played through the Rockband video game! We have vocals, drums and two guitar controllers to sing+play through the best songs rockband has to offer. Come sign up with your squad, or come solo and we will build a band around you. The best way to experience being in a band without actually needing to know how to play an instrument, guaranteed",All materials and controllers provided,True,False,False,forms/events.csv
Sanctuary Volunteers Meet and Greet,,Sanctuary,"Thursday, June 4",08:00:00 PM,09:00:00 PM,Other,A meet and greet for the Sanctuary volunteers. Get to know the leads and meet your fellow support staff. Have questions? This is a great time to get answers and see the space. Thank you for volunteering with Sanctuary!,,False,False,True,dust/events_forms.csv
Saturday Morning Cartoons,Fuzzy Wuzzy,Fuzzy Wuzzy,"Saturday, June 6",09:00:00 AM,11:00:00 AM,Party,"Come join us for Saturday morning cartoons on our very own fuzzy wuzzy network! We'll have cereal, coffee, and plenty of comfy spots on the rug to relive those classic early morning cartoons and fight over the remote.",Yes,True,False,True,dust/events_forms.csv
Seafood boil brunch!,,Bear Necessities,"Friday, June 5",12:00:00 PM,01:00:00 PM,Food,"We will be serving up a Louisiana style seafood boil! complete with crab legs, crawfish, shrimps, sausage, corn, and taters!! served in a kiddie pool with TONS of butter! (until we run out) bring your own mimosas if you want them! we only will be serving sweet tea at our bar!",,False,False,True,dust/events_forms.csv
Self-Care Sunday,Surreal Saloon,,"Sunday, June 7th",12:00:00 PM,1:00:00 PM,Event,"Need some rejuvenation after a wild night of burning? Come experience REGENESIS at the Surreal Saloon. We will have Interdimensional Moon Juice (a non-alcoholic electrolyte beverage) available to fuel your vessel. We will also have self care supplies available including face masks, lotions, nail care products, sensory toys and others. Come join us for a burn essential - Self Care Sunday.",Yes,True,False,False,forms/events.csv
Shibari rope tasting,The French Quarter,The French Quarter,"Saturday, June 6",02:00:00 PM,06:00:00 PM,Workshop,"Come to the French Quarter to experience some rope decoration or suspension. This event is open to everybody, whether you have been tied before or you want to try for the first time, or you just like to watch.",yes,True,False,True,dust/events_forms.csv
Slow Vinyasa Flow,,Sunshine Yoga Cafe,"Friday, June 5",11:15:00 AM,12:15:00 PM,Chill,"Bring your yoga mat and give yourself permission to slow down. \n\nIn this practice, we explore deep presence and juicy, rhythmic movement. \n\nBy slowing down the flow, we create space to breathe deeper, hold poses longer, and honor exactly what our bodies need.",,False,False,True,dust/events_forms.csv
Sno Cones!,,Banana Hammocks,"Thursday, June 4",02:00:00 PM,04:00:00 PM,Event,Give your mouth the pleasure of some delicious sno cones! Bring a cup!,,False,False,True,dust/events_forms.csv
Sound Bath Shavasana,,Sunshine Yoga Cafe,"Friday, June 5",03:00:00 PM,04:00:00 PM,Event,"Join us under the canopy for an extended Shavasana paired with an immersive sound bath. \n\nUse this time as a way to hit the reset button, restore your energy, and find calm. \n\nBring your mat, an eye mask or eye covering if you have one and prepare for shaded rest. \n\n*Note: we do have a sound camp nearby, so this sound bath may be a different sound experience- either way this will be a unique and magical experience.",,False,False,True,dust/events_forms.csv
Soup!!!! Soup!!!!,A Little Bit All Over the Place,A Little Bit All Over The Place,"Thursday, June 4",08:00:00 PM,09:00:00 PM,Food,"Ever night you can join us for dinner, usually we make delicous soups and stews.  Dinner starts whenever food is done and ends whenever we run out.",No materials used,True,False,True,dust/events_forms.csv
Sunshine Yoga Cafe Closing Ceremony,,Sunshine Yoga Cafe,"Sunday, June 7",03:45:00 PM,04:15:00 PM,Event,"Join us for a short yet meaningful closing ceremony as we check in with our internal spaces, honor the shifts we’ve experienced this week, and express gratitude for this fleeting time.\n\nTogether, we’ll anchor our intentions and begin the process of integrating our self-discoveries into our consciousness. \n\n*Note: This time is subject to change depending on the weather. check the whiteboard for schedule changes.",,False,False,True,dust/events_forms.csv
Synesthetic Ritual of Sensory Surrender,Sensua,Sensua,"Thursday, June 4",04:00:00 PM,06:00:00 PM,Event,"Reset your senses. Join us for an immersive experience featuring four-hand massage, warm wax, and violet wand electricity. From the grounding rhythm of impact to the enveloping waves of light and sound, we invite you into a high-sensory environment created to stimulate and heighten presence.",Yes,True,False,True,dust/events_forms.csv
Taking Space 2 Dance w/ Your Dragon w/ Christal,,Flow As You Go,"Thursday, June 4",05:00:00 PM,06:00:00 PM,Workshop,Taking Space 2 Dance w/ Your Dragon w/ Christal,,False,False,True,dust/events_forms.csv
Tarot: The Cult of Pawpaw Way,Helen Hachtel,,"Wednesday, June 3rd, Thursday, June 4th, Friday, June 5th, Saturday, June 6th, Sunday, June 7th",3:33:00 PM,3:34:00 PM,Game,"README.txt: This is an ad hoc, a la carte, all day (NOT MORNINGS!) event. If you show up in the morning, or linger in personal camp not taking a hint that Lenny ain't feeling it, you will be asked by the tarot cards to vacate the premises. Otherwise...

Cult of Pawpaw has a custom made 78 card deck ready to tell you vague and interesting events you can shoehorn into your own life if you try hard enough. Cards that speculate on the information you tell us as we're reading the cards, making it sound insightful and wise. Featuring Major Arcana cards such as The Forager and Climate uh... Evolution, this nonsense deck holds information that doesn't relate to anything or anyone. And some pawpaw facts.

This event can only be started by standing near Lenny (the British one) and yelling ""MY PAST IS DEAD AND MY FUTURE IS UNWRITTEN, I BEG YE LENNY TO TELL ME WHAT I'M MISSIN'""",Bring something to sit on.,True,False,False,forms/events.csv
Tea Service in The Grotto,Temple of the tea monks,Grotto - Open Community Space,"Friday, June 5",05:00:00 PM,07:00:00 PM,Food,This year the Tea Monks will providing a mobile tea service. come have tea with a tea monk in the beautiful Grotto. or find us pedaling around The Moon.,Small camp stove to heat water. Stove will sit in small table.,False,True,True,dust/events_forms.csv
Temple of the Burning Heart 🔥,,Temple,"Sunday, June 7",08:30:00 PM,10:30:00 PM,Fire,"Temple of the Burning Heart\n\nRising from the ash on Temple Hill stands—a sanctuary of impermanence, a monument to the stories we leave behind. Its wooden beams whisper with the weight of memory, each carved detail a prayer, each offering a farewell.\n\nHere, sorrow and joy entwine like smoke in the Tennessee wind. Here, burdens are set down, love is spoken, and silence is sacred. Within its radiant glow , past and present embrace—laughter echoes, grief lingers, and forgiveness takes root in the spaces between.\n\nAt its heart, fire awaits—not in destruction, but in transformation. Flames will consume, not to erase, but to release. As the temple turns to embers, so do the words, the wounds, the wishes woven into it. Nothing is lost. Everything is carried forward.\n\nThis is a place for letting go. This is a place for remembering. This is a place for beginning again.",,False,False,True,dust/events_forms.csv
The Burn is a Kaleidoscope,Big Fluffy Cloud,Big Fluffy Cloud,"Thursday, June 4",03:00:00 PM,04:00:00 PM,Workshop,Join us at Big Fluffy Cloud to make your own open-ended kaleidoscope and see the burn in a whole new way!,Yes,True,False,True,dust/events_forms.csv
The Dude's Cinema,Abiding Grove,,"Thursday, June 4th, Friday, June 5th, Saturday, June 6th",11:00:00 PM,12:30:00 PM,Performance,"Abiding Grove Walk-In Cinema showing The Big Lebowski and other Dudely movies.
We've got beverages and snacks, while you sit back and enjoy some classic cinema. Movies start around 11:00 pm at night.",We've got all you need. Just bring a cup and if you like your bathrobe.,True,False,False,forms/events.csv
"The Evolving Edge: Kink, Connection, and the Long-Term Partnership",Sensua,Sensua,"Saturday, June 6",11:00:00 AM,01:00:00 PM,Workshop,"Midday Lightly Guided Conversation\n\nWhen you’ve been together for years, and playing together for just as long, the conversation changes. It’s no longer about discovery in the beginner sense; it’s about evolution.\n\nHow do our kinks shift as our bodies change? How do we stay open to new energy when we share domestic life? How do we mediate shared history? \n\nJoin us for a relaxed, lightly facilitated midday honest conversation with other long-term partners.\n\nWe hope to go beyond the basics and discuss the nuances of a seasoned kink life:\n•The Integration Phase: Moving past scene night and looking at how power, play, and intimacy weave into the fabric of a long-term life.\n•The Changing Body: Navigating physical shifts, energy levels, and new boundaries with grace and creativity.\n•Deepening the Script: Breaking out of autopilot play and finding new edges within a familiar partnership.\n•Emotional Sustainability: Managing the Aftercare of a decade-long relationship.\n\nThis is a peer-level space for couples who are already active and looking for a thoughtful,  environment to talk shop. We provide the prompts and the structure; you provide the lived experience.\n\nExpect a friendly, high-trust atmosphere where the goal isn't to fix anything, but to honor where you’ve been and explore where you’re going next.",Yes,True,False,True,dust/events_forms.csv
The Next Generation - Meet up for Minors,,Garden Party,"Thursday, June 4",03:00:00 PM,04:00:00 PM,Event,"Hosted by the Garden Party kids, this meet up is for the next generation of burners and the people who are raising them! Make new connections and get tips on burning with kids from kids.",,False,False,True,dust/events_forms.csv
Theosophy and Gnosticism,,Sunshine Yoga Cafe,"Sunday, June 7",02:30:00 PM,03:30:00 PM,Workshop,Join us as we discuss Theosophy and Gnosticism\n\n*Note: the timing on this workshop is subject to change due to weather- we’ll update the whiteboard if there are any changes.,,False,False,True,dust/events_forms.csv
Too Many Clowns,The Thrifty Pickle,The Thrifty Pickle,"Friday, June 5",06:00:00 PM,07:30:00 PM,Party,"Are you down to clown? Prove it! Put on your big ol’ shoes and join us! Meet up at 6, walkabout at 7",The clown is within,True,False,True,dust/events_forms.csv
Way Holder Braiding Circle,,ReConnect Camp,"Friday, June 5",01:00:00 PM,02:00:00 PM,Workshop,"Come weave threads and shinies into a section of your hair to anchor in an intention - a goal, project, or simply your chosen life path. \n\nSupplies provided, but if you have any charms or anything you wish to weave in to yours, you're welcome to bring it!",,False,False,True,dust/events_forms.csv
We Chuckin - A nunchaku flow workshop,Flow As You Go,,"Friday, June 5th",2:00:00 PM,3:00:00 PM,Workshop,Learn nunchaku flow with Major Tom. All skill levels welcome.,There will be some extra chucks to use but bring a pair of you have them,True,False,False,forms/events.csv
Wire Wrapped Moon Pendants,Dominika,Spectral Subverse Dome,"Thursday, June 4th",4:00:00 PM,5:00:00 AM,Workshop,"Come wire wrap your very own moon pendant! Beginner friendly and all materials provided. This event will be held twice: 4p on Thursday, and 2p on Saturday

Back for the second year in a row, join us in the Spectral Subverse Dome to make your very own wire-wrapped crescent moon pendant. Multiple colors available!",Yes,True,False,False,forms/events.csv
open mic,A Little Bit All Over The Place,A Little Bit All Over The Place,"Friday, June 5",06:00:00 PM,09:00:00 PM,Music,we will be hosting an open mic while cooking and serving food.,Some instruments provided,True,False,True,dust/events_forms.csv
upside down time (headstands),Flow as you go - River,,"Thursday, May 29",1:00:00 PM,1:30:00 PM,Workshop,"Get out of you head, and onto it! Headstands for beginners - simple, safe and fun!",,True,False,False,forms/events.csv
ɹǝʌᴉɹ /ʍ ǝɯᴉʇ uʍop ǝpᴉsdn  (Upside down time w/ River),,Flow As You Go,"Thursday, June 4",01:00:00 PM,01:30:00 PM,Workshop,"Get out of you head, and onto it! \nHeadstands for beginners - simple, safe and fun!",,False,False,True,dust/events_forms.csv
