What shall we call your Event?,Who is hosting? Theme Camp or Your name,"Not a Theme Camp? Please give us a location (art installation, lakeside, effigy, temple.. etc)",Which day(s) will your event take place?,What time will your event start?,What time will your event end?,Select a theme of your event for Pocket Guide!,Description of your play-learn-workshop-event for the Pocket Guide!,"If Materials Are Used, Will You Provide Them?",present_in_forms_events_csv,present_in_forms_grotto_events_csv,present_in_dust_events_csv,prioritized_source
"""Moment of Peace"" Sober Sesh",Summer,Grotto - Open Community Space,"Thursday, June 4, Friday, June 5, Saturday, June 6, Sunday, June 7",11:00:00 AM,12:00:00 PM,Event,"An opportunity for people who are burning clean, sober burners, or burners in recovery to meet like-minded people, check in with each other, and help each other experience the Burn from a Recovery-minded perspective.",Maybe a hot kettle for water to make coffee & tea,False,True,False,forms/grotto_events.csv
"""Moment of Peace"" Sober Sesh Burner Meetup",Summer,The Grotto,"Thursday, June 4th, Friday, June 5th, Saturday, June 6th, Sunday, June 7th",11:00:00 AM,12:00:00 PM,Event,"A chance for all burners who are burning clean, in Recovery, Sober, or even just sober-curious, to meet like-minded burners and check-in with each other. It's a great way to grow your network of support for whatever your path may be. ALL ARE WELCOME!!",Tea/Coffee provided. We might run out of room for everyone to sit on the stage so a blanket/chair might not be a bad idea.,True,False,False,forms/events.csv
Ad Fontes Twisted Disco,Charles Barrett,Hasn’t been assigned yet,"Thursday, June 4th, Friday, June 5th, Saturday, June 6th",12:00:00 PM,2:00:00 AM,Music,Multi Genre Vinyl Driven Dance Music,,True,False,False,forms/events.csv
Afternoon Tea,Psilocybe Garden,Psilocybe Gardens,"Friday, June 5th, Saturday, June 6th",5:00:00 PM,6:00:00 PM,Food,Our famous homebrew beverage service 🍹 bring a cup! First come first serve 🍄,"No, please bring a cup!",True,False,False,forms/events.csv
Banana Lounge & Hammock Forest,,Banana Hammocks,"Thursday, June 4",12:00:00 AM,12:00:00 AM,Event,Come relax! Open 24 hours! \nNo Shoes inside!,,False,False,True,dust/events_forms.csv
Bare & Boozy Cocktail Hour,,Nudie Misfits,"Thursday, June 4",02:00:00 PM,03:00:00 PM,Food,"Shed your inhibitions (and anything else) for the most liberating happy hour, where birthday suits are encouraged and the drinks flow as freely as the radical self-expression.\nSip cocktails and toast to body positivity, good vibes, and questionable tan lines. No shirt, no shoes, bare butt — no problem!",,False,False,True,dust/events_forms.csv
Beginner Flow Fandamentals,,Flow As You Go,"Friday, June 5",01:00:00 PM,02:00:00 PM,Workshop,Beginner Flow Fandamentals\nFans w/ Glytch,,False,False,True,dust/events_forms.csv
Beginner/Intermediate Duel Dynamics,,Flow As You Go,"Saturday, June 6",02:00:00 PM,03:00:00 PM,Workshop,Beginner/Intermediate Duel Dynamics\nFans & Doublehoops w/ Glytch,,False,False,True,dust/events_forms.csv
Beginner/Intermediate Windmills on the Runway,,Flow As You Go,"Saturday, June 6",05:00:00 PM,06:00:00 PM,Workshop,Beginner/Intermediate Windmills on the Runway\nDragonstaff w/ Christal,,False,False,True,dust/events_forms.csv
Beginning/Intermediate Shooting Fountains Errwhere,,Flow As You Go,"Friday, June 5",05:00:00 PM,06:00:00 PM,Workshop,Beginning/Intermediate Shooting Fountains Errwhere\nDragonstaff / Christal,,False,False,True,dust/events_forms.csv
Beginning/Intermediate We Chuckin,,Flow As You Go,"Friday, June 5",02:00:00 PM,03:00:00 PM,Workshop,Beginning/Intermediate We Chuckin\nNunchuks w/ Major Tom,,False,False,True,dust/events_forms.csv
Breakfast delights,,A Little Bit All Over The Place,"Thursday, June 4",10:00:00 AM,11:00:00 AM,Food,"More spontaneously times than dinner, come join us for breakfast. Food will be done a few hours after Ithr cook wakes up until we run out of food.",,False,False,True,dust/events_forms.csv
Broken Barbie Regenesis,Swag n Dab,,"Friday, June 5th, Saturday, June 6th, Sunday, June 7th",10:00:00 AM,7:00:00 PM,Event,"Help build the Broken Barbie Regenisis Sculpture! Take a part, name it, make it beautiful, and add it to the collective build.",All parts and beautification tools provided.,True,False,False,forms/events.csv
Brother Jon's Birthday,,Heathen Life,"Friday, June 5",07:00:00 PM,08:00:00 PM,Food,"Do you know Brother Jon (once known as Beef Supreme,)? Did you know he's a year older as of June 5th? Well, now you do and you are invited to his birthday party. There will be music, booze, snacks, merry making, and Brother Jon.",,False,False,True,dust/events_forms.csv
Burn Arena!!,Khaos,Kamp Khaos Arena,"Saturday, June 6",10:00:00 PM,01:00:00 AM,Game,"The gates of the Arena open and the Mob goes wild! Gladiator Warz has been released upon the burn! Come on down and beat your opponents senseless in the best adult bopper game of the East coast! Choose helmet, armor, and weapons to get in the ring and DOMINATE!",Kamp Khaos will provide all the necessary materials,True,False,True,dust/events_forms.csv
Cheese Tasting,The French Quarter,The French Quarter,"Friday, June 5",06:00:00 PM,07:30:00 PM,Food,Come to the French Quarter to taste a selection of fancy and interesting cheeses you may not have tried before!,yes,True,False,True,dust/events_forms.csv
"Come as you are, flow as you go - open flow with music and friends",Flow As You Go,Flow As You Go,"Friday, June 5",12:00:00 PM,08:00:00 PM,Music,"Flow as you go is an interactive collaboration of flow, musical, and visual arts, and we invite you to come as you are, flow as you go! We have djs spinning chill music daily from 12-8pm. So bring some props and enjoy a shaded flow space, or cool off in our oasis  While our flow area will only feature live music from 12-8pm, please note we do have a flow area for use anytime of day!","Bring your own props, we may have extra but can’t guarantee that.",True,False,True,dust/events_forms.csv
Community Spark-Up,Psilocybe Garden,Psilocybe Garden,"Wednesday, June 3rd, Thursday, June 4th, Friday, June 5th, Saturday, June 6th, Sunday, June 7th",4:20:00 PM,5:00:00 PM,Other,A daily gathering of well-respected individuals,BYOB!,True,False,False,forms/events.csv
Drum Circle,Ananda,Temple,"Thursday, June 4th",6:30:00 PM,8:30:00 PM,Music,"Calling all drummers, dancers, rhythm chasers & vibe makers. We’re forming a drum circle near the temple at 6:30PM. Bring your drum.
Bring your feet.
Bring your energy.

Or just bring yourself and jump in. Follow the sound. Find the circle.",We may have some spare drums,True,False,False,forms/events.csv
Effigy Burn 🔥,,Effigy Burn Field,"Saturday, June 6",08:30:00 PM,10:30:00 PM,Fire,Conclave and Effigy Burn begin shortly after dusk on Saturday,,False,False,True,dust/events_forms.csv
Elven Elixirs,,ReConnect Camp,"Friday, June 5",11:00:00 AM,03:00:00 PM,Food,Do you party too hard? Or just need some rejuvenation? Your resident elven herbalist has your back. I've got TCM teas made to bring you back to life and sweeter treats like rose falooda to lift your spirits. 11am til we run out. Come by each day for different elixirs. Water station always available.,,False,False,True,dust/events_forms.csv
Fiesta pickles on a stick!,,Bear Necessities,"Saturday, June 6",12:00:00 PM,01:00:00 PM,Food,"Swing by the Bear Necessities for a Fiesta pickle on a stick! loads of flavors! mild or spicy available! Will have sweet tea! available until we run out, so get there on time!",,False,False,True,dust/events_forms.csv
Figure Drawing and Chill,,Heathen Life,"Saturday, June 6",01:00:00 PM,02:00:00 PM,Workshop,"For those who would like to practice drawing the human form! We will draw people in different poses over varying periods of time. Paper, pencils, and clipboards will be provided. People are encouraged to volunteer to model (you don't have to be nude unless you want to!). It's just chilling and drawing.",,False,False,True,dust/events_forms.csv
Fire Safety Meeting,,Effigy Burn Field,"Thursday, June 4",06:00:00 PM,07:00:00 PM,Workshop,"Fire performers must attend one of the fire safety meetingsand obtain a piece of Conclave swag. This swag will enable you to spin fire throughout the burn in the various camps and participate in the Conclave Saturday night. \n\nFire performers must only fire perform in designated performance areas separated from the crowd under the supervision of an aware, trained safety with blanket in hand or on the ground in front of them. Before each burn, check that your physical state (props, fuel, skills, wind speed, and clothing) and mental state (sober!) are appropriate. All Conclave participants (fire performers and fire safety volunteers, new and experienced) must attend one of the fire safety meetings listed below at the effigy field, and please bring fuel donations. There will be live fire demonstrations, so please wear fire-safe clothing.\n\nFor all these meetings and events, bring your safeties! New or veteran, we would be overjoyed for you to spin fire with us!",,False,False,True,dust/events_forms.csv
Flogger Making,Sensua,Sensua,"Friday, June 5",12:00:00 PM,02:00:00 PM,Workshop,Make your own flogger from recycled materials. We supply the materials.,We will provide materials,True,False,True,dust/events_forms.csv
Flotilla party on the lake,,Cool as Fuck!,"Sunday, June 7",01:00:00 PM,04:00:00 PM,Party,"Hey amazing people, when we last came to TTM two years ago we got a Flotilla together on the lake at 1:00 on the Sunday and about 50 rafts showed up and we had ourselves a fun ‘ol time. Let’s do that again, shall we. Same time and place, weather permitting. BYO Raft.",,False,False,True,dust/events_forms.csv
Flow As You Go - Grotto flow jam,Flow As You Go,Grotto - Open Community Space,"Thursday, June 4",06:00:00 PM,10:00:00 PM,Party,"Open flow jam - flow as you go\nFunsized, Decoy & friends",,False,True,True,dust/events_forms.csv
Foreskin Restoration Workshop,Georgia Peanuts,,"Saturday, June 6th",1:00:00 PM,2:00:00 PM,Workshop,"In the United States the circumcision of an infant is considered normal. But some people impacted by this action come to view it as a non-consensual genital modification. Circumcision can have negative consequences: reduced sensitivity, curvature of the penis, painful erections and more. Come to this workshop to learn about foreskin restoration. These are methods to grow the skin of the penis with consistent stretching (think ear gauging) to ultimately gain enough tissue for the appearance and functionality of a foreskin. You’ll learn about the history of circumcision in the USA, the anatomy of the penis (do you know where your raphe is?) and about foreskin restoration techniques and resources. I will demonstrate manual stretching exercises and the usage of some commercially available tuggers. The tuggers will be available for people to try out after the lecture. Come with your dick questions.",Yes,True,False,False,forms/events.csv
Free flow in the grotto,Flow as you go!,The Grotto,"Thursday, May 29",6:00:00 PM,10:00:00 PM,Music,"Flow As You Go invites you to join us for a flow jam in the grotto to kick off the burn! All props and skill levels are welcome to join. We will have djs spinning , so grab some props and come flow in the grass with us!!",Bring your props and yourself!,True,False,False,forms/events.csv
Get Glow'd,,ReConnect Camp,"Friday, June 5",07:00:00 PM,08:30:00 PM,Workshop,"Humans already bioluminesce, just too softly to see. Let's make it visible. Come reconnect with your inner light through glow in the dark paints. \n\nPaint yourself, paint your clothes, paint your friends. Or adorn with henna for a different kind of glow.",,False,False,True,dust/events_forms.csv
Gifting Table,LSD,Grotto - Open Community Space,"Thursday, June 4",09:00:00 AM,09:00:00 PM,Workshop,Gifting Table for people to enjoy,,False,True,True,dust/events_forms.csv
Gluten Free Friday Tea Party,Garden Party,Garden Party,"Friday, June 5",02:00:00 PM,05:00:00 PM,Food,"Radical Inclusion through food! The Gluten Free Friday Tea Party is a celebration of and for all of us with tummy troubles! In order to avoid cross contamination, I am partnering with a bakery that describes itself as:\n\nCertified gluten-free by the National Celiac Association and entirely wheat-free, seed oil-free, nut-free, vegan, dairy-free, egg-free, seed-free & natural dyes only. \n\nWe will have all kinds of safe snacks, tea, and a social hour where you are welcome to say as much about the gory details of your tummy troubles as you want or absolutely nothing at all about them. 🩷❤️🩷","Bring your mug, cup, plate",True,False,True,dust/events_forms.csv
Guided Journey into the Elven Realm,,The Faerie Portal (Reconnect Camp),"Friday, June 5",12:00:00 AM,12:30:00 AM,Event,"Wind down from the party with a guided meditation. Step through the Portal with me to meet the elves and explore their bioluminescent realm as they support us in our Regenesis. We wash away the old outdated versions of us and they nurture our new growth, celebrating the You that you get to discover anew.",,False,False,True,dust/events_forms.csv
Haunted House,Big Spooky Energy,Big Spooky Energy,"Thursday, June 4",10:00:00 PM,12:00:00 AM,Other,"Come check out our walk through haunted house filled with illusions, animatronics, and live actors.",Yes,True,False,True,dust/events_forms.csv
How We Roll - 101,,Abiding Grove,"Thursday, June 4",04:15:00 PM,05:15:00 PM,Workshop,"Come join fellow Dudes at Abiding Grove for a workshop on the finer art of rolling like a Duder. Former resident Dudeist Priest of Amsterdam, Cake Man, will guide aspiring rollers through shaping techniques and the gentle philosophy behind the craft. Bring your own supplies to roll with, though we'll have some of the Dude's business papers available on-site. Relaxed vibes and curious minds welcome.\nThursday • 4:20 PM • ~60 min",,False,False,True,dust/events_forms.csv
Hypnotic Regenesis,New Technique from DreamCamp,DreamCamp,"Sunday, June 7",03:30:00 PM,04:41:00 PM,Workshop,"Tap into the past, activate presence and generate the future! Immerse yourself in this guided experience of hypnotic trance, neuro-linguistic programming and heightened, conscious awareness with New Technique!","Yes, I will provide.",True,False,True,dust/events_forms.csv
Ice Sales 🧊,,DPW (Dept of Public Works),"Thursday, June 4",10:00:00 AM,02:00:00 PM,Other,"7lb bags of ice will be available for purchase at $5 Thursday through Sunday from 10–7pm adjacent to the quartermaster. Price and bag size subject to change based on availability. Cash, tap to pay, or Venmo, are accepted.",,False,False,True,dust/events_forms.csv
Integration Circle,,ReConnect Camp,"Sunday, June 7",02:00:00 PM,04:00:00 PM,Other,"How has this burn changed you? What magic did you experience? \n\nHere you can share what's on your heart, witness and be witnessed, as we process our time on this land together in community.",,False,False,True,dust/events_forms.csv
Interdimensional Moon Juice and Nail Art,Surreal Saloon,,"Friday, June 5th",4:20:00 PM,5:20:00 PM,Event,"Come wet your whistle at the Surreal Saloon! We will be serving NON-alcoholic electrolyte fueled beverages to power you through your burn. You can also partake in our nail services to dress your lovely self up for a weekend of fancy fun. Come join us for an afternoon of moon juice, nail decor, and self-care!",Yes,True,False,False,forms/events.csv
Intermediate Breaking Barriers,,Flow As You Go,"Friday, June 5",03:00:00 PM,04:00:00 PM,Workshop,Intermediate Breaking Barriers\nHoops w/ Dizzy,,False,False,True,dust/events_forms.csv
Intermediate Poi on Purpose,,Flow As You Go,"Saturday, June 6",12:00:00 PM,01:00:00 PM,Workshop,Intermediate Poi on Purpose\nw/ Yams,,False,False,True,dust/events_forms.csv
Karaoke,A Little Bit All Over The Place,A Little Bit All Over The Place,"Thursday, June 4",06:00:00 PM,09:00:00 PM,Food,We will be hosting kwraoke while we are cooking and serving food!,No materials,True,False,True,dust/events_forms.csv
Kenny Chezney,,Wood Petter's Lounge,"Saturday, June 6",11:00:00 PM,12:00:00 AM,Music,"Come out with your cowperson hats and cowperson boots and get ready for something you've never seen at To The Moon! Kenny Chezney will be performing live at our camp sometime after the effigy burn! if you don't have cowperson attire, camo and ballcaps will do! Let's get down with all the amazing music Kenny Chezney has lined up for us, here in the hills of good old east Tennessee.",,False,False,True,dust/events_forms.csv
Lo-Bear and Willy-D’s Wedding Celebration,Lo-Bear and Willy-D,Grotto - Open Community Space,"Saturday, June 6",3:30:00 PM,5:00:00 PM,Event,For our wedding and for a duo silks performance (as our first dance),We plan to set up an A-frame and silks on Wednesday or Thursday. It is about 15x15,False,True,False,forms/grotto_events.csv
Lo-Bear and Willy-D’s burn wedding,(this would be at the grotto but our theme came is Long Furby Postage Express/ Jungle of Obscurities),We will be hosting this at the grotto,"Saturday, June 6th",3:30:00 PM,5:00:00 PM,Event,"They’ve signed the papers, but that was just the pregame. Now Lo-Bear and Willy-D are getting BURN MARRIED! Come celebrate as they tie the knot again.",We are bringing an aerial rig and silks. It would be really lovely to get help with seats and tables through. (probably 20 chairs and 3 tables) though it is okay if that cannot happen.,True,False,False,forms/events.csv
MIMOSAS & METAL IN THE MORNING,Just People,,"Saturday, June 6th",11:00:00 AM,12:00:00 PM,Music,"You're invited! Join us Saturday at 11:00 a.m. as Camp Just People hosts its signature morning event — Mimosas & Metal in the Morning!

Come kick back with a perfectly crafted mimosa while our resident DJ, Jazzy Bill ""D"" Funk, takes you through an electrifying hour of the finest, most unapologetically loud metal the world has to offer.

Expect a refreshing drink, an unforgettable setlist, and zero chill — except for your mimosa.

Black tie and an arrogant attitude are entirely optional.",Yes,True,False,False,forms/events.csv
Make-Your-Own Ramen Bar,Wayward Bud,Wayward Bud,"Friday, June 5",08:00:00 PM,02:00:00 AM,Food,"Warm up at Wayward Bud’s late-night Make-Your-Own Ramen Bar! Enjoy a wide selection of instant noodles, delicious toppings, and a variety of options to accommodate dietary restrictions and allergies. All self-serve.\n Just bring your own bowl and utensils!",Yes,True,False,True,dust/events_forms.csv
Mandatory Conclave Safety Meeting,,Effigy Burn Field,"Saturday, June 6",03:00:00 PM,04:00:00 PM,Workshop,"Mandatory conclave safety meeting at Effigy Burn Field on Saturday at 3pm.\n\nFor all these meetings and events, bring your safeties! New or veteran, we would be overjoyed for you to spin fire with us!",,False,False,True,dust/events_forms.csv
Meowgarita party!,,Cool as Fuck!,"Thursday, June 4",08:00:00 PM,10:00:00 PM,Food,"Dust off your whiskers and brush off your fancy ears and slip on your finest feline flair for a night of purrfectly unhinged decadence. We’re serving custom cat-themed margaritas, glowing vibes, and enough cat ears to summon nine lives’ worth of chaos.\n\nCome dressed as a sassy housecat, ferocious tiger, mysterious sphinx, disco panther, or whatever strange creature inspires.\n\nExpect roaming cats, fuzzy fashion, and late-night mischief under the stars.\n\nNo humans allowed. Only cats in disguise.",,False,False,True,dust/events_forms.csv
Metal Hour!,Camp Pretty Lights,Camp Pretty Lights,"Friday, June 5",03:00:00 PM,04:00:00 PM,Party,"Need a break from the EDM while you are on the Moon? Join Camp Pretty Lights on Friday afternoon at 3pm for some METAL! \nWe'll be blasting some head-banging tunes 🎶 featuring deep cuts of our favorite bands. Bring your ID, we will have refreshments for those old enough!",,True,False,True,dust/events_forms.csv
Mid-Day Meditation,,Sunshine Yoga Cafe,"Friday, June 5",12:15:00 PM,01:00:00 PM,Chill,"Drop into your highest self with this midday group meditation with your Sangha- your community. Gather under the shade of our canopy to pause, breathe, and realign. \n\nBring your yoga mat and take a break from the midday sun.",,False,False,True,dust/events_forms.csv
Midday Mass,Cult of Pawpaw,,"Friday, June 5th, Saturday, June 6th",12:00:00 PM,1:00:00 PM,Event,"Blessed be the fruit! Readings from sacred texts, sermons and libations, and whatever else the spirit moves us to do. We welcome both returning and new congregants, as we explain the purpose of The Cult and our Mission, educate the feeble minds of the non-believers, and give out free stuff you can eat, drink, and grow.",Yes,True,False,False,forms/events.csv
Misting station and Igloo!,,Bear Necessities,"Thursday, June 4",12:00:00 PM,05:00:00 PM,Chill,will have misters for you to walk through to cool off! We also have an air-conditioned igloo you can go in to hide from the heat and sun!,,False,False,True,dust/events_forms.csv
Molten Moments: A Live Glassworking Experience,Twig @ Spectral Subverse,,"Friday, June 5th, Saturday, June 6th",7:00:00 PM,9:00:00 PM,Performance,"Take a captivating look into flame-worked glass, where fire and artistry converge. Watch raw glass rods transform under intense heat and delicate control into intricate forms. This demo highlights key tools, safety practices, and techniques—revealing how precision and temperature shape the craft. Perfect for newcomers and seasoned creatives, it offers a close-up view of chemistry and creativity in glowing harmony. Stay after to ask questions and explore the tools behind the magic.","This is a showcase, no material gifting guaranteed",True,False,False,forms/events.csv
Mooney Putt Portals,Multiple Camps and Artists,"Nine holes (so far) will be at the following camps. 
Swag 'n Dab
Space Clowns from Outer Space in Yo Space
Toys, Treats, and Tiny Things
Banana Hammocks
Broken Drum
Art Department
Back Lit Moon Lounge
Fuzzy Wuzzy
Patchwork Petal Parlor","Thursday, June 4th, Friday, June 5th, Saturday, June 6th, Sunday, June 7th",9:00:00 AM,12:00:00 AM,Game,"Mooney Putt Portals
Interdimensional mini golf experiment
How it works
•	There are 9 portals—visit in any order.
•	Use the map to hunt them down.
•	Keep score—weird trophies and shiny prizes lurk.
•	Claim a sticker. Adorn your self or your stuff.
•	Putters and balls live at each hole—please leave them in their native realm.
•	Bring your own freaky putter for a 3 stroke bonus.
•	Share the magic: don’t whack humans.
•	Putt, giggle, repeat.
Step through a portal and play a hole!","Putters, balls, and scorecards will be at each hole. Build and bring your own funky putter for extra glam!",True,False,False,forms/events.csv
"Morning Breathwork, Meditation, and Slo-Flow Yoga",,Sunshine Yoga Cafe,"Friday, June 5",10:00:00 AM,11:00:00 AM,Chill,"This is your time for an internal reset and a space to find complete calm. \n\nBring your yoga mat and sit under our canopy for breathwork, meditation, and yin yoga. We will gently stretch our minds and bodies, allowing us to fully welcome in all that this beautiful day has to offer.",,False,False,True,dust/events_forms.csv
Morning Coffee & Tea,Abiding Grove,,"Thursday, June 4th, Friday, June 5th, Saturday, June 6th, Sunday, June 7th",9:30:00 AM,12:30:00 PM,Food,"🛸🐮 Conspiracy Coffee ☕ :
Give a Conspiracy for every Coffee ☕, a Theory for every Tea 🫖, but the Marie Antoinette cakes are Free 🧁.","Beverages, Cakes , Lounge & Chill vibes.",True,False,False,forms/events.csv
Open Arena!!,Kamp Khaos,Kamp Khaos Arena,"Friday, June 5",07:00:00 PM,11:00:00 PM,Game,"The gates of the Arena open and the Mob goes wild! Gladiator Warz has been released upon the burn! Come on down and beat your opponents senseless in the best adult bopper game of the East coast! Choose helmet, armor, and weapons to get in the ring and DOMINATE!",We provide everything beyond the participants themselves :),True,False,True,dust/events_forms.csv
Opening Ceremony and Grounding Breathwork,,Sunshine Yoga Cafe,"Thursday, June 4",06:30:00 PM,07:30:00 PM,Event,"Let’s open this space with intention and call ourselves home. \n\nAfter the flurry of arrival and the energy of setting up camp, join us to drop out of the doing and into the being. \n\nThrough gentle, grounding breath work and shared presence, we will root ourselves into the earth, connect with ourselves, and set a collective intention for the beautiful weekend ahead. \n\nWelcome home.",,False,False,True,dust/events_forms.csv
P.R.E.A.C.H.,Cult of Pawpaw,,"Thursday, June 4th",5:00:00 PM,6:00:00 PM,Event,"People Ranting Enthusiastically About Cultish Hobbies

Got a cool hobby? A scorching hot take? A hill you will die on? Take the mic and testify. P.R.E.A.C.H. is an open soapbox to give amplified sound to the passionate and possessed.

Rants, sermons, TED talks, or interpretive dances welcome. You have three minutes to P.R.E.A.C.H. about whatever your own personal cult is about.

No sign-up, just show up and do your thang. Exceptions apply (aka don't be a dick).",Microphone and soapbox,True,False,False,forms/events.csv
Pho Me Daddy - POWER HOUR!,Fantasy Island,Fantasy Island,"Friday, June 5",09:00:00 PM,11:00:00 PM,Food,"Set sail for Fantasy Island and join us for the ""Pho Me Daddy Power Hour!"" Come dive into a delicious bowl of vegan pho Friday night at 9 PM. Please BYO bowl/utensils. Fantasy Island, we'll be wading.",No,True,False,True,dust/events_forms.csv
